id,created_at,text,tweet,subjectivity,polarity,sentiment
758120147810869248,2016-07-27 02:01:43,"b""RT @CNBC: A rare look inside Tesla's 'gigafactory' https://t.co/QsPaJN4zpO""",rare look inside tesla,0.9,0.3,Positive
758119840158588928,2016-07-27 02:00:29,"b""RT @solarimpulse: BREAKING: we flew 40'000km without fuel. It's a first for energy, take it further! #futureisclean https://t.co/JCvKTDBVZx""",break fly without fuel first energy take futureisclean,0.6166666666666667,0.525,Positive
758063362802528256,2016-07-26 22:16:04,b'Insurance premiums expected to decline by 80% due to driverless cars \nhttps://t.co/nuPKOI9v1D',insurance premium expect decline due driverless car,0.375,-0.125,Negative
758004517887696896,2016-07-26 18:22:14,b'Letter from basically every scientific org in the United States to Congress about climate change https://t.co/vo1I1HY5fx',letter basically every scientific org united state congress climate change,0.0,0.0,Neutral
758003098816286720,2016-07-26 18:16:36,b'Via @NPR: Sun-Powered Airplane Completes Historic Trip Around The World https://t.co/AKe5VRaY5o',via airplane complete historic trip around world,0.2,0.05,Positive
757600711714701312,2016-07-25 15:37:39,b'@ID_AA_Carmack Maybe as a future optimization. Would only matter if it was extremely big.',maybe future optimization would matter extremely big,0.1125,0.0,Neutral
756664069646487554,2016-07-23 01:35:46,"b""@vicentes as long as I'm alive""",long alive,0.4,0.025,Positive
756663746764742656,2016-07-23 01:34:30,b'https://t.co/Kgkz1Z3FwJ',,0.0,0.0,Neutral
756365671571726336,2016-07-22 05:50:03,b'Looking forward to the Gigafactory opening party on Friday next week. The scale blows me away every time I see it.',look forward gigafactory open party friday next week scale blow away every time see,0.25,0.0,Neutral
756004029239472132,2016-07-21 05:53:01,b'Autopilot prevents serious injury or death of a pedestrian in NY (owner anecdote confirmed by vehicle logs) https://t.co/NceuqckqCK',autopilot prevent serious injury death pedestrian ny owner anecdote confirm vehicle log,0.6666666666666666,-0.3333333333333333,Negative
755990352511705088,2016-07-21 04:58:40,"b'@danahull Jerome is driving Tesla Semi &amp; doing a great job with his team. At Daimler, he led their most successful semi truck program ever.'",jerome drive tesla semi amp great job team daimler lead successful semi truck program ever,0.85,0.775,Positive
755989215976882176,2016-07-21 04:54:09,"b""@danahull It's inspired by some of the California Custom VW combi design art""",inspire california custom vw combi design art,0.0,0.0,Neutral
755940191571808257,2016-07-21 01:39:21,b'@MRamseyWSJ Great game. Whole Fallout series is amazing.',great game whole fallout series amazing,0.6124999999999999,0.30000000000000004,Positive
755931999487991810,2016-07-21 01:06:47,b'@katiefehren Both should have been done under the same corporate umbrella from the beginning',do corporate umbrella begin,0.0,0.0,Neutral
755929747763245061,2016-07-21 00:57:51,"b'Tesla Master Plan, Part Deux\nhttps://t.co/XQeTlsoEdE'",tesla master plan part,0.0,0.0,Neutral
755859976816427010,2016-07-20 20:20:36,b'@elonmusk now 2Pac',,0.0,0.0,Neutral
755841679454720000,2016-07-20 19:07:53,b'California time',california time,0.0,0.0,Neutral
755841606960373760,2016-07-20 19:07:36,b'Post should go live on Tesla website around 5pm',post go live tesla website around,0.5,0.13636363636363635,Positive
755830992812711937,2016-07-20 18:25:26,b'@vitiral yup',yup,0.0,0.0,Neutral
755825075245297664,2016-07-20 18:01:55,b'@AnnaDotBlue busted',bust,0.0,0.0,Neutral
755808603706011648,2016-07-20 16:56:28,b'Except for the tweet about large amounts of crack (actually just small amounts)',except tweet large amount crack actually small amount,0.41428571428571426,-0.017857142857142863,Negative
755784816847495168,2016-07-20 15:21:56,b'Not easy to convey irony in a tweet',easy convey irony tweet,0.8333333333333334,0.43333333333333335,Positive
755778920989896704,2016-07-20 14:58:31,b'@princeghosh97 Lana',lana,0.0,0.0,Neutral
755773618538242048,2016-07-20 14:37:26,b'Finishing off the plan while listening to the soundtrack from Gatsby. Seems appropriate...',finish plan listen soundtrack gatsby seem appropriate,0.5,0.5,Positive
755439077235814400,2016-07-19 16:28:06,"b'Will be working at Tesla on Autopilot &amp; Model 3 today, then aiming to pull an all-nighter and complete the master product plan'",work tesla autopilot amp model today aim pull complete master product plan,0.4,0.1,Positive
755438366817153024,2016-07-19 16:25:16,b'@drehmer I am!',,0.0,0.0,Neutral
755420049536606208,2016-07-19 15:12:29,b'Returning from Cape Canaveral to California...',return cape canaveral california,0.0,0.0,Neutral
755167487017291776,2016-07-18 22:28:53,"b'Really tempting to redesign upper stage for return too (Falcon Heavy has enough power), but prob best to stay focused on the Mars rocket'",really tempting redesign upper stage return falcon heavy enough power prob good stay focus mar rocket,0.36,0.13999999999999999,Positive
755166100967550979,2016-07-18 22:23:23,"b""Can't wait to see all three cores of Falcon Heavy come back for landings! First two will be almost simultaneous. https://t.co/ryMiewZM4L""",ca wait see three core falcon heavy come back landing first two almost simultaneous,0.27777777777777773,0.016666666666666663,Positive
755140683112017920,2016-07-18 20:42:23,b'Landing https://t.co/dRWGyyTtCH',land,0.0,0.0,Neutral
755137454655541248,2016-07-18 20:29:33,b'@PaulPrijs @alexfrance free Babel fish provided',free babel fish provide,0.8,0.4,Positive
754968472929574912,2016-07-18 09:18:05,b'Bit of a distraction yesterday. Working on plan today.',bit distraction yesterday work plan today,0.0,0.0,Neutral
754931091891453952,2016-07-18 06:49:32,b'Out on LZ-1. We just completed the post-landing inspection and all systems look good. Ready to fly again. https://t.co/1OfA8h7Vrf',complete inspection system look good ready fly,0.6,0.45,Positive
754908615757234176,2016-07-18 05:20:14,b'Falcon on LZ-1 at Cape Canaveral https://t.co/dBkjBCDIRs',falcon cape canaveral,0.0,0.0,Neutral
754907067060715521,2016-07-18 05:14:04,"b'RT @SpaceX: Dragon on its way to @Space_Station, Falcon on its way home https://t.co/EpfUKBmoWi'",dragon way falcon way home,0.0,0.0,Neutral
754858623357095936,2016-07-18 02:01:35,"b'@BilalNaseer Thanks. Exactly. Some in the press think they\'re so much smarter than Tesla owners that ""they know better"". Makes no sense.'",thank exactly press think much smart tesla owner know well make sense,0.44642857142857145,0.23214285714285715,Positive
754804233107562496,2016-07-17 22:25:27,"b'@MacTechGenius V8 will be our biggest release since v1, so taking longer to refine. Awesome on every level. Meeting w design team every day.'",big release since take long refine awesome every level meeting w design team every day,0.5,0.31666666666666665,Positive
754801124755013633,2016-07-17 22:13:06,"b""Tesla customers are v smart &amp; don't want media speaking on their behalf abt Autopilot. Recent poll: 0.0% want it disabled -- not 0.1%, 0.0%.""",tesla customer v smart amp want medium speak behalf abt autopilot recent poll want disable,0.44642857142857145,0.10714285714285714,Positive
754798592880156672,2016-07-17 22:03:02,"b'@heroineworshipe @BoschGlobal It can at moderate range, but our ultrasonics are very good at human (or anything &gt;= water density) detection'",moderate range ultrasonic good human anything gt water density detection,0.46666666666666673,0.2333333333333333,Positive
754793746483572736,2016-07-17 21:43:47,"b""@MacTechGenius Improved fan speed algorithm coming soon. Doesn't need to be so loud.""",improve fan speed algorithm come soon need loud,0.8,0.1,Positive
754786895343779840,2016-07-17 21:16:33,b'Great rebuttal by a Tesla owner to those calling for Autopilot to be disabled. Was written with zero input from us. https://t.co/Kfg1ewKoCZ',great rebuttal tesla owner call autopilot disable write zero input us,0.75,0.8,Positive
754776743156805632,2016-07-17 20:36:13,b'@Tyler_K_Berg That is a very good point!',good point,0.6000000000000001,0.7,Positive
754772663365664768,2016-07-17 20:20:00,"b""Have to focus on tonight's @SpaceX launch. Will post Tesla (master) product plan afterwards.""",focus tonight launch post tesla master product plan afterwards,0.0,0.0,Neutral
754772024657113088,2016-07-17 20:17:28,"b'Btw, want to thank both Bosch and MobilEye for their help and support in making Autopilot better. Please direct all criticism at Tesla.'",btw want thank bosch mobileye help support make autopilot well please direct criticism tesla,0.4,0.1,Positive
754769913814941696,2016-07-17 20:09:05,"b'Promising call today with @BoschGlobal, maker of our radar sensor. Looks like significant improvements possible via OTA software update.'",promise call today maker radar sensor look like significant improvement possible via ota software update,0.9375,0.1875,Positive
754687525034270720,2016-07-17 14:41:42,b'@Mikey67Tang much appreciated',much appreciate,0.2,0.2,Positive
754687383308730368,2016-07-17 14:41:08,b'@reddersla Usually true. We need more sane and reasonable people making their voice heard.',usually true need sane reasonable people make voice hear,0.625,0.275,Positive
754652713418428419,2016-07-17 12:23:22,b'Sensible article on Autopilot by @the guardian https://t.co/BbvXaNI4Xk',sensible article autopilot guardian,0.0,0.0,Neutral
754484362406719488,2016-07-17 01:14:24,"b'RT @SpaceX: All systems go &amp; weather 90% favorable for launch of Dragon to @Space_Station. Liftoff slated for Monday, 12:45am ET https://t.\xe2\x80\xa6'",system go amp weather favorable launch dragon liftoff slate monday et,0.0,0.0,Neutral
754448482581086208,2016-07-16 22:51:49,"b'RT @TheRealBuzz: 47 years ago today Neil, Mike &amp; I took a ride on a big rocket to the moon. \nLiftoff on #Apollo11 https://t.co/FrvdmddkYo'",year ago today neil mike amp take ride big rocket moon,0.1,0.0,Neutral
754385834682351616,2016-07-16 18:42:53,b'RT @NASA: LIVE NOW: Find out what experiments are headed to @Space_Station on the next @SpaceX launch: https://t.co/4E487vfn5N https://t.co\xe2\x80\xa6',live find experiment head next launch,0.25,0.06818181818181818,Positive
754284893471780864,2016-07-16 12:01:47,"b""@ForIn2020 @KellyBlueJazz On the other hand I do answer a toy phone like it's real""",hand answer toy phone like real,0.30000000000000004,0.2,Positive
754277459009298432,2016-07-16 11:32:14,b'@ForIn2020 @KellyBlueJazz large amounts of crack',large amount crack,0.42857142857142855,0.21428571428571427,Positive
754275814456201216,2016-07-16 11:25:42,"b'@KellyBlueJazz 6 hours normally, but a lot less these days'",hour normally lot less day,0.3583333333333333,-0.008333333333333331,Negative
754272832440250368,2016-07-16 11:13:51,b'Sunday is the end of the week :)',sunday end week,0.0,0.0,Neutral
754272460602617856,2016-07-16 11:12:22,b'@Guid00 yes',yes,0.0,0.0,Neutral
754272271372398592,2016-07-16 11:11:37,b'@shortword good up to ~160km/h',good,0.6000000000000001,0.7,Positive
754263267199979520,2016-07-16 10:35:51,b'Our radar is using a wavelength of 3.9mm. A good size for both decent resolution and rain penetration. Am hopeful...',radar use wavelength good size decent resolution rain penetration hopeful,0.6333333333333333,0.4333333333333333,Positive
753845365846138880,2016-07-15 06:55:15,b'@RuthEdick especially well',especially well,1.0,0.0,Neutral
753844173313183745,2016-07-15 06:50:31,b'@pfierens Logs were downloaded for NHTSA and NTSB. Identical copies to all.',log download nhtsa ntsb identical copy,0.0,0.0,Neutral
753843823546028040,2016-07-15 06:49:07,"b'Good thing about radar is that, unlike lidar (which is visible wavelength), it can see through rain, snow, fog and dust'",good thing radar unlike lidar visible wavelength see rain snow fog dust,0.6000000000000001,0.7,Positive
753795303170420736,2016-07-15 03:36:19,b'@collinalexbell yes',yes,0.0,0.0,Neutral
753791633204781058,2016-07-15 03:21:44,b'@erik_smith1 @ihavetweets certainly moderate and maybe big advances w no incremental hardware',certainly moderate maybe big advance w incremental hardware,0.39999999999999997,0.0,Neutral
753789713807355904,2016-07-15 03:14:07,b'@ihavetweets effective stereo by comparing data at various points in time while moving',effective stereo compare datum various point time move,0.65,0.3,Positive
753788944714649600,2016-07-15 03:11:03,b'@SimplyDonya elevation too',elevation,0.0,0.0,Neutral
753786870379581442,2016-07-15 03:02:49,b'@DanistopMe only just gained access to physical vehicle',gain access physical vehicle,0.14285714285714285,0.0,Neutral
753786447904198657,2016-07-15 03:01:08,b'@att1cus86 @DMC_Ryan AP process crash would show up in logs',ap process crash would show log,0.0,0.0,Neutral
753785936257835008,2016-07-15 02:59:06,"b'Working on using existing Tesla radar by itself (decoupled from camera) w temporal smoothing to create a coarse point cloud, like lidar'",work use exist tesla radar decouple camera w temporal smooth create coarse point cloud like lidar,0.5,0.2,Positive
753781810518122497,2016-07-15 02:42:42,"b""@DMC_Ryan Maybe didn't realize he turned it off, but the car does issue a loud chime and a visual warning on the instrument cluster.""",maybe realize turn car issue loud chime visual warn instrument cluster,0.4,0.05,Positive
753710366006267904,2016-07-14 21:58:49,b'@scojjac exactly',exactly,0.25,0.25,Positive
753699861636128768,2016-07-14 21:17:04,"b'Onboard vehicle logs show Autopilot was turned off in Pennsylvania crash. Moreover, crash would not have occurred if it was on.'",onboard vehicle log show autopilot turn pennsylvania crash moreover crash would occur,0.0,0.0,Neutral
753681461576740864,2016-07-14 20:03:57,b'EU regulators find no safety concerns with Autopilot\nhttps://t.co/zOykm4XeHP',eu regulator find safety concern,0.0,0.0,Neutral
753525069553381376,2016-07-14 09:42:31,"b""@TheHackersNews @defcon It's all fun &amp; games until ... https://t.co/cRAn0S8ooX""",fun amp game,0.30000000000000004,-0.05000000000000002,Negative
753125662874042369,2016-07-13 07:15:25,"b""We don't mind taking the heat for customer safety. It is the right thing to do. From @RoadandTrack https://t.co/D181ui1jB0""",mind take heat customer safety right thing,0.5357142857142857,0.2857142857142857,Positive
752721031735812096,2016-07-12 04:27:33,"b""@kumailn @RealDaveBarton @JuddApatow @SiliconHBO @FredericLambert @MikeJudge can't wait to see the costume""",ca wait see costume,0.0,0.0,Neutral
752719954219192320,2016-07-12 04:23:16,b'@RealDaveBarton @kumailn @JuddApatow @SiliconHBO @FredericLambert Only if I can play a monkey',play monkey,0.0,-0.05,Negative
752680739213156353,2016-07-12 01:47:27,"b""Tesla finishes last in being salesy! Good. Also, I can't believe there is a real Pied Piper.\nhttps://t.co/9Zzijxxyy4""",tesla finish last salesy good also ca believe real pie,0.32222222222222224,0.3,Positive
752405437199192064,2016-07-11 07:33:29,"b""RT @Eddy_Jahn: @spacex @elonmusk Not sure if you've seen this, but great video of your progress #SpaceX 4 years in 4 minutes. https://t.co/\xe2\x80\xa6""",sure see great video progress spacex year minute,0.8194444444444444,0.65,Positive
752272158517112835,2016-07-10 22:43:53,b'Something like that https://t.co/aufFuB5VXo',something like,0.0,0.0,Neutral
752270839458869249,2016-07-10 22:38:39,b'@nickg_uk already taken care of',already take care,0.0,0.0,Neutral
752218264499949568,2016-07-10 19:09:44,b'Kinda. Creating a seamlessly integrated Tesla battery &amp; solar power product that looks beautiful is the reason https://t.co/4z6MzBB9p2',kinda create seamlessly integrate tesla battery amp solar power product look beautiful reason,0.55,0.475,Positive
752204733339701249,2016-07-10 18:15:58,b'@SwiftOnSecurity I like your tweets!',like tweet,0.0,0.0,Neutral
752204607753842688,2016-07-10 18:15:28,"b'@SwiftOnSecurity Tricky in 140 chars, but: 1B needed for min statistical sample size. More software mods and data may be needed beyond that.'",tricky char need min statistical sample size software mod datum may need beyond,0.4,0.2,Positive
752203559043641344,2016-07-10 18:11:18,b'Blog on Autopilot by @PeterDiamandis https://t.co/LR5zuw3J9X',blog autopilot,0.0,0.0,Neutral
752201456980078593,2016-07-10 18:02:57,b'@bolayer @SwiftOnSecurity US is ~11 deaths per billion miles. WW is 17 deaths per billion. Autopilot already much better than either so far.',us death per billion mile ww death per billion autopilot already much well either far,0.6,0.15000000000000002,Positive
752199681166315521,2016-07-10 17:55:53,"b""@c4757p @SwiftOnSecurity Unless we get there and find it isn't enough. Just won't be before 1B.""",unless get find enough wo,0.5,0.0,Neutral
752198648469917696,2016-07-10 17:51:47,"b'@FantaAIex It is extensively tested in the lab and in the Tesla test fleet. However, there is no substitute for real world experience.'",extensively test lab tesla test fleet however substitute real world experience,0.31666666666666665,0.1,Positive
752197971253485568,2016-07-10 17:49:06,"b""@SwiftOnSecurity With less than 1B miles, there simply isn't enough data. 1B is a necessary but not necessarily sufficient condition.""",less mile simply enough datum necessary necessarily sufficient condition,0.6416666666666666,-0.041666666666666664,Negative
752196881871040512,2016-07-10 17:44:46,"b'@nicatronTg @SwiftOnSecurity Thanks. Point of calling it ""beta"" was to emphasize to those who chose to use it that it wasn\'t perfect.'",thank point call beta emphasize choose use perfect,1.0,1.0,Positive
752195886990569473,2016-07-10 17:40:49,b'@_CraigR @FortuneMagazine exactly',exactly,0.25,0.25,Positive
752195771093512192,2016-07-10 17:40:21,"b""@wfederman @stegen @FortuneMagazine that wasn't criticism, just clarification""",criticism clarification,0.0,0.0,Neutral
752195495263514624,2016-07-10 17:39:15,b'@SwiftOnSecurity why?',,0.0,0.0,Neutral
752195291093213185,2016-07-10 17:38:27,b'@wfederman @stegen @FortuneMagazine thought I was posting Reuters. Copied the wrong link.',think post reuter copy wrong link,0.9,-0.5,Negative
752193726462586881,2016-07-10 17:32:14,b'@vicentes Probably six months. Will include hundreds of refinements to handle rare corner cases in Autopilot.',probably six month include hundred refinement handle rare corner case autopilot,0.9,0.3,Positive
752193163742228480,2016-07-10 17:29:59,"b""@stegen @FortuneMagazine you're right, no point""",right point,0.5357142857142857,0.2857142857142857,Positive
752192639403896833,2016-07-10 17:27:54,"b'@chirag Use of word ""beta"" is explicitly so that drivers don\'t get comfortable. It is not beta software in the standard sense.'",use word beta explicitly driver get comfortable beta software standard sense,0.4,0.2,Positive
752190828798353408,2016-07-10 17:20:43,"b'Misunderstanding of what ""beta"" means to Tesla for Autopilot: any system w less than 1B miles of real world driving \nhttps://t.co/WG5vnFvegI'",misunderstand beta mean tesla autopilot system w less mile real world drive,0.3513888888888889,-0.09305555555555554,Negative
752184088111362048,2016-07-10 16:53:56,"b""Today is Nikola Tesla's birthday. I hope he likes what we've done in his name.""",today nikola tesla birthday hope like do name,0.0,0.0,Neutral
752182992982843392,2016-07-10 16:49:35,"b'Working on Top Secret Tesla Masterplan, Part 2. Hoping to publish later this week.'",work top secret tesla masterplan part hope publish later week,0.39999999999999997,0.033333333333333326,Positive
751648486416871424,2016-07-09 05:25:38,"b'@BrooklynBrett @LeoOD3 @Conleich Story was fed to LAT &amp; many other media to counter IMF $5T/year fossil subsidy study. Hey, both have a 5!'",story feed lat amp many medium counter imf fossil subsidy study hey,0.5,0.5,Positive
751647322375876608,2016-07-09 05:21:01,b'@AllyTaft seriously',seriously,0.6666666666666666,-0.3333333333333333,Negative
751635420644044800,2016-07-09 04:33:43,"b""Love reddit. Gandel gets shredded &amp; won't even answer top 3 upvoted questions. Some really funny comments about Koch https://t.co/PJrqys3Rmc""",love reddit gandel get shred amp wo even answer top upvoted question really funny comment koch,0.7000000000000001,0.4166666666666667,Positive
751516148739416064,2016-07-08 20:39:47,"b'Model S had the lowest probability of injury of any car ever tested by NHTSA, which is why ... https://t.co/9tZZJEc5wg'",model low probability injury car ever test nhtsa,0.3,0.0,Neutral
751513849770053632,2016-07-08 20:30:38,"b""RT @DougEatwell: Elon Musk's Unbelievably Simple 12-minute Killer Break Down on Climate Change: https://t.co/vlZuS5ZVW4 via @YouTube @Tripl\xe2\x80\xa6""",elon musk unbelievably simple killer break climate change via,0.35714285714285715,0.0,Neutral
751513637861224449,2016-07-08 20:29:48,b'@polina_marinova @alansmurray @CNBC thanks',thank,0.0,0.0,Neutral
751318492775747586,2016-07-08 07:34:22,"b'@mrmeireles true, good point'",true good point,0.625,0.5249999999999999,Positive
751304230594613248,2016-07-08 06:37:41,"b""@alansmurray No, you were misleading mostly on your own, but w many copycats. Jalopnik just lost it's sense of irony &amp; didn't get my tweet.""",mislead mostly w many copycat jalopnik lose sense irony amp get tweet,0.5,0.5,Positive
751034693684912128,2016-07-07 12:46:39,b'RT @VanityFair: How the media screwed up the fatal Tesla accident https://t.co/ZwHbpKbSaZ https://t.co/5ii04Yq1ZD',medium screw fatal tesla accident,0.0,0.0,Neutral
750838518524542980,2016-07-06 23:47:07,"b'@disinformatico @Eddy_Jahn cool, thanks :)'",cool thank,0.65,0.35,Positive
750837854021058560,2016-07-06 23:44:28,b'@gdoehne @disinformatico @Eddy_Jahn The Google term of self-driving would probably be more appropriate then.',google term would probably appropriate,0.5,0.5,Positive
750837202398093312,2016-07-06 23:41:53,"b'@disinformatico @Eddy_Jahn In other words, the intended implication is that a driver must remain alert, just as a pilot must remain alert.'",word intend implication driver must remain alert pilot must remain alert,0.0,0.0,Neutral
750836652109594626,2016-07-06 23:39:42,"b'@disinformatico @Eddy_Jahn Tesla Tesla Autopilot is named after aircraft autopilot, as it is always expected that a pilot must stay alert.'",tesla tesla autopilot name aircraft autopilot always expect pilot must stay alert,0.0,0.0,Neutral
750835746613915648,2016-07-06 23:36:06,"b'@jacobrossi All publicly known Tesla product developments are called out, incl vehicles and batteries. Would be odd *not* to include.'",publicly know tesla product development call incl vehicle battery would odd include,0.15833333333333333,-0.08333333333333333,Negative
750829352229695488,2016-07-06 23:10:41,b'Tesla response to the misleading Fortune articles about Autopilot https://t.co/zWRM3aMnVC',tesla response mislead fortune article autopilot,0.0,0.0,Neutral
750820987676061696,2016-07-06 22:37:27,b'Sponsored articles \xe2\x80\xa6 https://t.co/i8QsJYU4Ee',sponsor article,0.0,0.0,Neutral
750593838264246272,2016-07-06 07:34:51,b'RT @Gizmodo: Hyperloop connecting Helsinki to Stockholm would turn a 300-mile trip into a 28-minute ride https://t.co/zeruuwufKk https://t.\xe2\x80\xa6',hyperloop connect helsinki stockholm would turn trip ride,0.0,0.0,Neutral
750446098020503552,2016-07-05 21:47:47,b'Because of course I hate flamingos...(maybe try eating fewer flamingo eggs in your salad)\nhttps://t.co/tUKsWqCobo',course hate flamingo maybe try eat few flamingo egg salad,0.5,-0.5,Negative
750354728169644032,2016-07-05 15:44:42,b'@apple_defense @samabuelsamid Exactly! I love Twitter.',exactly love twitter,0.6,0.5,Positive
750353176570789888,2016-07-05 15:38:32,b'@samabuelsamid Wrong to exclude non-occupant deaths. Autopilot would have prevented this cyclist from being killed https://t.co/ic9liqnyDN',wrong exclude death autopilot would prevent cyclist kill,0.9,-0.5,Negative
750351150382194688,2016-07-05 15:30:29,"b'@alansmurray If you care about auto deaths as material to stock prices, why no articles about 1M+/year deaths from other auto companies?'",care auto death material stock price article death auto company,0.0,0.0,Neutral
750350191044259840,2016-07-05 15:26:41,"b""@alansmurray Yes, it was material to you -- BS article increased your advertising revenue. Just wasn't material to TSLA, as shown by market.""",yes material bs article increase advertising revenue material tsla show market,0.0,0.0,Neutral
750330135723769856,2016-07-05 14:06:59,"b'RT @nickbilton: 1.3 million people die a year in car accidents. Yet, 1 person dies in a Tesla on autopilot and people decry driverless cars\xe2\x80\xa6'",million people die year car accident yet person die tesla autopilot people decry driverless,0.0,0.0,Neutral
748625979271045121,2016-06-30 21:15:16,b'@artem_zin @theaweary Radar tunes out what looks like an overhead road sign to avoid false braking events',radar tune look like overhead road sign avoid false brake event,0.6,-0.4000000000000001,Negative
748620607105839104,2016-06-30 20:53:56,b'Our condolences for the tragic loss https://t.co/zI2100zEGL',condolence tragic loss,0.75,-0.75,Negative
748144067972759552,2016-06-29 13:20:20,b'@NikolaNikolov16 Shakespeare. Then love-devouring death do what he dare; \nIt is enough I may but call her mine.',shakespeare death dare enough may call mine,0.5,0.0,Neutral
748141575163654144,2016-06-29 13:10:25,b'@collinalexbell aspirationally',aspirationally,0.0,0.0,Neutral
748140919501656066,2016-06-29 13:07:49,"b'My son recently asked what my favorite animal was. Well, of course \xe2\x80\xa6 https://t.co/hpTniMe1mF'",son recently ask favorite animal well course,0.625,0.25,Positive
748136300952182785,2016-06-29 12:49:28,b'Thoughtful analysis of the Tesla/SolarCity merger by @tsrandall https://t.co/4Ba3px7hb8',thoughtful analysis merger,0.5,0.4,Positive
747887079808327680,2016-06-28 20:19:09,b'Thanks for the kind bday wishes!',thank kind bday wish,0.9,0.6,Positive
