id,created_at,text,tweet,subjectivity,polarity,sentiment
622065785268088834,2015-07-17 15:30:15,b'Model S product call at 11 today. Rocket discussion at noon on Monday.',model product call today rocket discussion noon monday,0.0,0.0,Neutral
620358355240947712,2015-07-12 22:25:32,b'RT @DavidBrin: If the moon were only 1 pixel: a ginormously accurate scale model of the solar system!! http://t.co/feqQ0k1B6d',moon pixel ginormously accurate scale model solar system,0.6333333333333334,0.4000000000000001,Positive
619579138181967872,2015-07-10 18:49:12,"b'RT @TeslaMotors: \xe2\x80\x9cOne must be sane to think clearly, but one can think deeply &amp; be quite insane.\xe2\x80\x9d Nikola Tesla. Happy b-day to you. http://\xe2\x80\xa6'",must sane think clearly one think deeply amp quite nikola tesla happy,0.5944444444444444,0.3,Positive
617851905969127425,2015-07-06 00:25:48,"b'Expect to reach preliminary conclusions regarding last flight by end of week. Will brief key customers &amp; FAA, then post on our website.'",expect reach preliminary conclusion regard last flight end week brief key customer amp faa post website,0.4666666666666666,0.0,Neutral
617719485768843265,2015-07-05 15:39:36,b'RT @GreenCarReports: Tesla Model S Owner Loyalty Probably Unparalleled In Industry http://t.co/QM51ePGr4z',tesla model owner loyalty probably unparalleled industry,0.0,0.0,Neutral
615431934345216001,2015-06-29 08:09:41,b'Cause still unknown after several thousand engineering-hours of review. Now parsing data with a hex editor to recover final milliseconds.',cause still unknown several thousand review parse datum hex editor recover final millisecond,0.5333333333333333,-0.03333333333333333,Negative
615197659624816642,2015-06-28 16:38:46,b'@DavidBrin Thanks David',thank david,0.0,0.0,Neutral
615186062714011648,2015-06-28 15:52:41,"b'@adventFuturist yeah, not the best birthday'",yeah good birthday,0.6000000000000001,0.7,Positive
615185689999765504,2015-06-28 15:51:12,"b""That's all we can say with confidence right now. Will have more to say following a thorough fault tree analysis.""",say confidence right say follow thorough fault tree analysis,0.5357142857142857,0.2857142857142857,Positive
615185076813459456,2015-06-28 15:48:46,b'There was an overpressure event in the upper stage liquid oxygen tank. Data suggests counterintuitive cause.',overpressure event upper stage liquid oxygen tank datum suggest counterintuitive cause,0.0,0.0,Neutral
615178702343786498,2015-06-28 15:23:26,b'@juanmlemao Thanks :)',thank,0.0,0.0,Neutral
615167185229619202,2015-06-28 14:37:40,b'Falcon 9 experienced a problem shortly before first stage shutdown. Will provide more info as soon as we review the data.',falcon experience problem shortly first stage shutdown provide info soon review datum,0.3333333333333333,0.25,Positive
615114562766008320,2015-06-28 11:08:34,b'RT @SpaceX: On track for launch tomorrow to @Space_Station. Liftoff targeted for 10:21am ET \xe2\x80\x93 watch live http://t.co/tdni5406Hi http://t.co\xe2\x80\xa6',track launch tomorrow liftoff target et watch live,0.5,0.13636363636363635,Positive
614874698741084161,2015-06-27 19:15:26,b'Drone hexacopter takes pic of drone ship OCISLY on station in the Atlantic https://t.co/DONcOD8hSD',drone hexacopter take pic drone ship ocisly station atlantic,0.0,0.0,Neutral
614814177962627072,2015-06-27 15:14:57,"b'Droneship ""Of Course I Still Love You"" just before it left port https://t.co/rhn4z82NVl'",droneship course still love leave port,0.6,0.5,Positive
614756523244437504,2015-06-27 11:25:51,"b'Trying for another rocket landing tmrw. This time on the droneship ""Of Course I Still Love You"". https://t.co/6LGnzhWLLr'",try another rocket land tmrw time droneship course still love,0.6,0.5,Positive
614755637403193344,2015-06-27 11:22:20,"b""@NoMansSky You're welcome. Good conversation.""",welcome good conversation,0.75,0.75,Positive
614645132181291008,2015-06-27 04:03:13,b'@connollyjeff1 @TheStreet End of year',end year,0.0,0.0,Neutral
614626025960570880,2015-06-27 02:47:18,b'Credit for SolarCity is really due to Rive bros &amp; great team there. My contribution is fairly small.\nhttp://t.co/AVkHMz2bmS via @thestreet',credit solarcity really due rive bro amp great team contribution fairly via,0.6749999999999999,0.4583333333333333,Positive
614258809473626112,2015-06-26 02:28:07,b'RT @SpaceX: The why and how of landing rockets http://t.co/9EPrDnfRX7 \nhttps://t.co/NE1POjpZXW',land rocket,0.0,0.0,Neutral
613366102756712448,2015-06-23 15:20:49,b'Important to note that Model S resale value is also higher than that of gasoline cars',important note model resale value also high gasoline car,0.77,0.28,Positive
613121687698018304,2015-06-22 23:09:36,b'RT @pierre: Looks like our AI babies will be fed a diet of CNN and Daily Mail: DeepMind Teaches Machines to Read | MIT Tech Rev http://t.co\xe2\x80\xa6',look like ai baby feed diet cnn daily mail deepmind teach machine read mit tech rev,0.0,0.0,Neutral
612019874773078016,2015-06-19 22:11:23,b'Tesla service team helps save a stray kitten that took refuge in a Model S. Nice work guys! https://t.co/Ddp5K9MpW2',tesla service team help save stray kitten take refuge model nice work guy,1.0,0.6,Positive
610484933132292096,2015-06-15 16:32:04,"b'To be clear, SpaceX is supporting a student design competition for STEM, not trying to build Hyperloop itself. Other cos are doing latter.'",clear spacex support student design competition stem try build hyperloop cos latter,0.19166666666666665,0.05000000000000001,Positive
610482435873091584,2015-06-15 16:22:09,b'SpaceX/Tesla will also do a reference pod to be shown after the @Hyperloop competition. Bonus for all racing teams that exceed reference.',also reference pod show competition bonus race team exceed reference,0.0,0.0,Neutral
610479010309541888,2015-06-15 16:08:32,b'RT @Hyperloop: Announcing the @SpaceX Hyperloop Pod Competition http://t.co/ZQHjHtkuAj https://t.co/AtCkkRnjHt',announce hyperloop pod competition,0.0,0.0,Neutral
609215984499605504,2015-06-12 04:29:44,"b'My kids love ""The Lost Planet"" by @RachelSearles. Now on a rare second read!'",kid love lose planet rare second read,0.5,0.26666666666666666,Positive
606942167072776192,2015-06-05 21:54:23,b'RT @SpaceX: Falling back to Earth https://t.co/GesWzUZeq2',fall back earth,0.0,0.0,Neutral
605878361613725696,2015-06-02 23:27:12,b'RT @waitbutwhy: The Story of Tesla: http://t.co/z73rocumMi Nothing has every taken any human as long as this took me. Good luck. http://t.c\xe2\x80\xa6',story tesla nothing every take human long take good luck,0.3666666666666667,0.21666666666666665,Positive
605460768516014080,2015-06-01 19:47:50,"b'@kpe @SpaceX @grierallen @natedapore Cool, thanks for letting us know. This is helpful for figuring out fairing reusability.'",cool thank let us know helpful figure fair reusability,0.775,0.5249999999999999,Positive
603409579603415040,2015-05-27 03:57:09,b'Air Force certifies @SpaceX to compete for launching national security satellites http://t.co/tLYcEDJFPV',air force certifie compete launch national security satellite,0.0,0.0,Neutral
601669073441697792,2015-05-22 08:41:00,"b""What are the best riddles you've heard that are short enough for Twitter?""",good riddle hear short enough twitter,0.46666666666666673,0.2333333333333333,Positive
601665000948649984,2015-05-22 08:24:49,b'Another good riddle: drill a hole thru a sphere such that the height of what remains of the sphere is 10cm. What is its remaining volume?',another good riddle drill hole thru sphere height remain sphere remain volume,0.6000000000000001,0.7,Positive
601578147113529344,2015-05-22 02:39:41,b'Astronomer Royal Martin Rees: How soon will robots take over the world? - via @Telegraph http://t.co/DStxgM0S8F',astronomer royal martin ree soon robot take world via,0.0,0.0,Neutral
601501265332477952,2015-05-21 21:34:11,b'RT @SpaceX: Cargo is offloaded and spacecraft is powered down. #Dragon back in its nest after about 5 weeks at the @Space_Station http://t.\xe2\x80\xa6',cargo offload spacecraft power dragon back nest week,0.0,0.0,Neutral
600784025335136256,2015-05-19 22:04:08,"b'This is not the full Gigafactory, it is just the pilot plant (1/4 size) https://t.co/gz2EmJkYtm'",full gigafactory pilot plant size,0.55,0.35,Positive
600549508796190720,2015-05-19 06:32:15,"b'Fossil fuels subsidised by $10m a minute, says IMF  http://t.co/c4nsZjXc32'",fossil fuel subsidise minute say imf,0.0,0.0,Neutral
599964926992486401,2015-05-17 15:49:20,"b'RT @johngreen: My brilliant brother has a message for you, future dead person. https://t.co/kHy5nRuXxY'",brilliant brother message future dead person,0.5083333333333333,0.2333333333333333,Positive
599391754786181122,2015-05-16 01:51:45,b'RT @SpaceX: Tired of the same old travel destinations? Discover the wonder of Mars \nhttp://t.co/KpluQw4cow http://t.co/vD9oLSuY5r',tired old travel destination discover wonder mar,0.44999999999999996,-0.15000000000000002,Negative
599391737094635520,2015-05-16 01:51:40,b'RT @SpaceX: Adventure awaits! Explore Mars\xe2\x80\x99 ultimate vacation destinations \nhttp://t.co/KpluQw4cow http://t.co/kptj27x1LD',adventure await explore ultimate vacation destination,1.0,0.0,Neutral
598232495537016832,2015-05-12 21:05:16,b'@jankenbrandt Hi Julie!',hi julie,0.0,0.0,Neutral
598174400404262912,2015-05-12 17:14:25,b'RT @TeslaMotors: Agreed. @FTC affirms States to allow consumers to choose how they buy their cars. #Tesla #Michigan http://t.co/fT1JHjMpzg',agree affirm state allow consumer choose buy car tesla michigan,0.0,0.0,Neutral
598151191923568641,2015-05-12 15:42:11,b'@ChristieNic Thanks Christie',thank christie,0.0,0.0,Neutral
598146466557796352,2015-05-12 15:23:25,"b'@TeslaP85D That is true. If someone says they are thinking about having kids, I always encourage them to do so.'",true someone say think kid always encourage,0.65,0.35,Positive
598065854736044032,2015-05-12 10:03:05,"b""It is total BS &amp; hurtful to claim that I told a guy to miss his child's birth just to attend a company meeting. I would never do that.""",total bs amp hurtful claim tell guy miss child birth attend company meeting would never,0.75,0.0,Neutral
598064094206234624,2015-05-12 09:56:06,"b""Of 22 Quotes from http://t.co/VA2KQ03NNR, 2 need correcting:\n1. I strongly support pregnancy leave\n2. I've never called myself a samurai""",quote need correct strongly support pregnancy never call samurai,0.7333333333333333,0.4333333333333333,Positive
597982078374817794,2015-05-12 04:30:12,"b""@voxdotcom I have never written or said this. Ashlee's book was not independently fact-checked. Should be taken w a grain of salt.""",never write say ashlee book independently take w grain salt,0.125,0.0,Neutral
596053122587365376,2015-05-06 20:45:13,"b'Max acceleration was 6X gravity, altitude 1187m, lateral distance 1202m and velocity 155 m/s. Main chutes deployed 970m.'",max acceleration gravity altitude lateral distance velocity main chute deploy,0.3333333333333333,0.16666666666666666,Positive
596051269212459008,2015-05-06 20:37:51,b'Dragon abort test video\nhttps://t.co/qsdSCEcPnm',dragon abort test,0.0,0.0,Neutral
595977889356492800,2015-05-06 15:46:16,"b'Dragon abort test stats: 0 to 100 mph in 1.2 sec, top speed of 345 mph'",dragon abort test stat mph sec top speed mph,0.55,0.2,Positive
595960278610616320,2015-05-06 14:36:17,"b'RT @SpaceX: This morning, a Crew Dragon test article completed a Pad Abort Test, the 1st critical test in prep for human missions http://t.\xe2\x80\xa6'",morning crew dragon test article complete pad abort test critical test prep human mission,0.4333333333333334,0.03333333333333333,Positive
595656079490600960,2015-05-05 18:27:30,b'Hold down firing of Dragon 2 spacecraft at Cape Canaveral http://t.co/2626wb8596',hold fire dragon spacecraft cape canaveral,0.0,0.0,Neutral
595477224481955840,2015-05-05 06:36:48,"b""RT @NASA: Five things to know about Wednesday's @SpaceX Crew Dragon Pad Abort Test: http://t.co/9cpBBIBwse #LaunchAmerica http://t.co/sBOkw\xe2\x80\xa6""",five thing know wednesday crew dragon pad abort test launchamerica,0.0,0.0,Neutral
595208771716059136,2015-05-04 12:50:04,b'Very funny post of a Tesla owner test driving a gasoline car http://t.co/Tq2vNM5UnG',funny post tesla owner test drive gasoline car,1.0,0.25,Positive
594756342641922048,2015-05-03 06:52:16,"b'While I like the initials, I\'d take the so-called ""EM Drive"" with a grain o salt per @io9 article\nhttp://t.co/AmjyaI2fVP'",like initial take em drive grain salt per,0.0,0.0,Neutral
594750998398140417,2015-05-03 06:31:02,b'My favorite shot from the last rocket landing attempt on the droneship http://t.co/8a403c7Fv1',favorite shoot last rocket land attempt droneship,0.5333333333333333,0.25,Positive
594327204143599616,2015-05-02 02:27:02,"b""Last night's Tesla Powerwall and Powerpack unveiling https://t.co/ksD8m6nCJO""",last night tesla powerwall powerpack unveil,0.06666666666666667,0.0,Neutral
594187782609707008,2015-05-01 17:13:01,"b""@romn8tr Press conference went way over time. Tried to give all the journalists who'd traveled far an opportunity to ask a question.""",press conference go way time try give journalist travel far opportunity ask question,1.0,0.1,Positive
594186544174366720,2015-05-01 17:08:06,"b'For more info on Tesla Energy, check out press kit. $250/kWh for utility scale is the real kicker http://t.co/xE57uIUCse'",info tesla energy check press kit utility scale real kicker,0.30000000000000004,0.2,Positive
593804222811869184,2015-04-30 15:48:53,"b'@bonnienorman Haha, awesome :)'",haha awesome,0.65,0.6,Positive
593296401196388352,2015-04-29 06:10:59,"b'For the future to be good, we need electric transport, solar power and (of course) ... http://t.co/8mwVWukQDL'",future good need electric transport solar power course,0.36250000000000004,0.35,Positive
592836876622520323,2015-04-27 23:45:00,"b'Rocket launch good, satellite in geo transfer orbit. Still so damn intense. Looking fwd to it feeling normal one day.'",rocket launch good satellite geo transfer orbit still damn intense look fwd feel normal one day,0.75,0.3499999999999999,Positive
592602352659533824,2015-04-27 08:13:05,"b'Worth watching @ExMachinaMovie. The AI would be in the network, not the robot, but otherwise good.'",worth watch ai would network robot otherwise good,0.35000000000000003,0.5,Positive
592481964419993601,2015-04-27 00:14:42,"b""RT @SpaceX: Rocket moving to the pad tonight in advance of tomorrow's launch attempt. 6:14pm ET window opens. Weather 60% go. http://t.co/6\xe2\x80\xa6""",rocket move pad tonight advance tomorrow launch attempt et window open weather go,0.5,0.0,Neutral
592471975869620225,2015-04-26 23:35:01,b'RT @deadmau5: Here she is! :) @TeslaMotors http://t.co/LPiWuhNYsN',,0.0,0.0,Neutral
591062459349274624,2015-04-23 02:14:06,"b'@bonnienorman New Roadster battery should complete safety validation by end of July, so likely available in August'",new roadster battery complete safety validation end july likely available august,0.5636363636363636,0.1590909090909091,Positive
589820447660769281,2015-04-19 15:58:47,b'@andrewket @TeslaRoadTrip Wow!',wow,1.0,0.1,Positive
589579721488224256,2015-04-19 00:02:14,"b'While the rocket does look rather tall &amp; tippy, a stable landing is no problem with proper throttle response https://t.co/B4Y6D4dpsc'",rocket look rather tall amp tippy stable land problem proper throttle response,0.1,0.0,Neutral
589577558942822400,2015-04-18 23:53:38,b'Cause of hard rocket landing confirmed as due to slower than expected throttle valve response. Next attempt in 2 months.',cause hard rocket land confirm due slow expect throttle valve response next attempt month,0.32916666666666666,-0.1791666666666667,Negative
589505551366639618,2015-04-18 19:07:30,b'RT @TeslaMotors: Brand new Store &amp; Service Center in Shanghai Hongqiao. #Tesla #China http://t.co/bbsSksbZT7',brand new store amp service center shanghai hongqiao tesla china,0.2772727272727273,0.018181818181818174,Positive
589350633393627136,2015-04-18 08:51:55,b'@Aero4Real I only invest in companies I help found or to help a friend or a cause (no return expected for latter two)',invest company help find help friend cause return expect latter two,0.0,0.0,Neutral
589082811119763458,2015-04-17 15:07:41,b'RT @SpaceX: #Dragon is now fully attached to @Space_Station! Hatch opening to occur over the next day. http://t.co/W8JBYnWOWe',dragon fully attach hatch open occur next day,0.25,0.0,Neutral
588490238936240129,2015-04-15 23:53:01,b'Droneship is fine. No hull breach and repairs are minor. Impact overpressure is closer to a fast fire than an explosion.',droneship fine hull breach repair minor impact overpressure close fast fire explosion,0.4333333333333333,0.18888888888888888,Positive
588463193070022656,2015-04-15 22:05:33,"b'High resolution, color corrected, slow motion rocket landing video https://t.co/UTF3Y4xGU3'",high resolution color correct slow motion rocket land video,0.47,-0.07000000000000002,Negative
588145052981014531,2015-04-15 01:01:22,b'RT @SpaceX: Falcon 9 first stage landing burn and touchdown on Just Read the Instructions https://t.co/4Te0BfT2Qn',falcon first stage land burn touchdown read instruction,0.3333333333333333,0.25,Positive
588144086755999744,2015-04-15 00:57:32,"b""If this works, I'm treating myself to a volcano lair. It's time.""",work treat volcano lair time,0.0,0.0,Neutral
588142879245238273,2015-04-15 00:52:44,"b'Ok, looks like we got some killer footage from the chase plane. Big ocean, small ship. Posting vid shortly http://t.co/2F5FK0TZ0i'",ok look like get killer footage chase plane big ocean small ship post vid shortly,0.325,0.0625,Positive
588082574183903232,2015-04-14 20:53:06,"b'Looks like Falcon landed fine, but excess lateral velocity caused it to tip over post landing http://t.co/eJWzN6KSJa'",look like falcon land fine excess lateral velocity cause tip post land,0.5,0.4166666666666667,Positive
588076749562318849,2015-04-14 20:29:57,"b'Ascent successful. Dragon enroute to Space Station. Rocket landed on droneship, but too hard for survival.'",ascent successful dragon enroute space station rocket land droneship hard survival,0.7458333333333333,0.22916666666666666,Positive
588071136971206656,2015-04-14 20:07:39,b'3 mins to liftoff',min liftoff,0.0,0.0,Neutral
588059410137755649,2015-04-14 19:21:03,"b'RT @SpaceX: Weather 60% ""go"" for #Falcon9 launch today @ 4:10pm ET. Lightning/clouds still a concern. http://t.co/tdni5406Hi http://t.co/TH\xe2\x80\xa6'",weather go launch today et still concern,0.0,0.0,Neutral
587724440667947008,2015-04-13 21:10:00,"b'Launch window always tight when orbital synch needed. In this case, Space Station. For Earth-Sun gravity null point, moon was in the way.'",launch window always tight orbital synch need case space station gravity null point moon way,0.2857142857142857,-0.17857142857142858,Negative
587715056432889856,2015-04-13 20:32:43,b'Launch postponed due to lightning from an approaching anvil cloud',launch postpone due lightning approach anvil cloud,0.375,-0.125,Negative
587704139225759744,2015-04-13 19:49:20,b'Odds of rocket landing successfully today are still less than 50%. The 80% figure by end of year is only bcs many launches ahead.',odd rocket land successfully today still less figure end year bcs many launch ahead,0.44166666666666665,0.22916666666666669,Positive
587682798644805633,2015-04-13 18:24:32,"b""RT @westcoastbill: an illustrated guide from .@popmech for today's historic @spacex lauch http://t.co/JI4u4KiXwf""",illustrate guide today historic lauch,0.0,0.0,Neutral
587681982546448384,2015-04-13 18:21:17,"b'RT @SpaceX: #Falcon9 &amp; #Dragon now vertical in advance of today\xe2\x80\x99s CRS-6 launch, targeted for 4:33pm ET. http://t.co/tdni53IviI http://t.co/\xe2\x80\xa6'",amp dragon vertical advance launch target et,0.0,0.0,Neutral
587488583591849984,2015-04-13 05:32:47,b'RT @SpaceX: Just Read the Instructions on location &amp; ready for tomorrow\xe2\x80\x99s 1st stage landing attempt. http://t.co/tdni53IviI http://t.co/GYe\xe2\x80\xa6',read instruction location amp ready stage land attempt,0.5,0.2,Positive
587421152819208193,2015-04-13 01:04:51,b'Have asked SolarCity if we can do something philanthropic with the CA aqueducts to help the water crisis. Investigating\xe2\x80\xa6',ask solarcity something philanthropic ca aqueduct help water crisis,0.0,0.0,Neutral
587193821227651072,2015-04-12 10:01:31,b'@benfeldman63 Thanks!',thank,0.0,0.0,Neutral
586767303464751104,2015-04-11 05:46:41,"b""We debated this, but there really is $10k gas saved by most owners over 5 yrs (avg ownership period). Since it's true, we are sticking w it.""",debate really gas save owner yrs avg ownership period since true stick w,0.42500000000000004,0.275,Positive
586750857565220864,2015-04-11 04:41:20,b'Waited to say something until after we fixed some of the options pricing (too high) and colors (too many similar)',wait say something fix option pricing high color many similar,0.48,0.22,Positive
586750504450916352,2015-04-11 04:39:56,"b'Just announced new Tesla 70D all-wheel drive, 240 mile range car for ~$55k (after gas savings &amp; incentives)\nhttp://t.co/tDb2tCbeT0'",announce new tesla drive mile range car gas saving amp incentive,0.45454545454545453,0.13636363636363635,Positive
586722721322692608,2015-04-11 02:49:32,"b'To land a rocket, Just Read the Instructions \nhttp://t.co/FJAM72zNWo'",land rocket read instruction,0.0,0.0,Neutral
586202560404434944,2015-04-09 16:22:36,b'Testing of the high performance version of the Tesla Model S by @ConsumerReports\nhttps://t.co/bvgEVgMswU',testing high performance version tesla model,0.5399999999999999,0.16,Positive
586195989167382528,2015-04-09 15:56:29,"b'RT @StephenKing: Took my Tesla out to a dragstrip last week and ran the 1/4 mile. 112 MPH, 0 to 60 in 4 seconds. Like driving an X-Wing fig\xe2\x80\xa6'",take tesla dragstrip last week run mile mph second like drive,0.03333333333333333,0.0,Neutral
585185843649716225,2015-04-06 21:02:32,"b'Battery ""breakthroughs"" need to state power *and* energy density (not the same thing), plus how long they last. They usually fail on energy.'",battery breakthrough need state power energy density thing plus long last usually fail energy,0.25555555555555554,-0.18333333333333335,Negative
585183983576551424,2015-04-06 20:55:08,b'RT @SpaceX: Falcon 9 and Dragon undergoing prep in FL in advance of 4/13 launch to the @Space_Station http://t.co/0KGddcVzV0 http://t.co/7F\xe2\x80\xa6',falcon dragon undergo prep fl advance launch,0.0,0.0,Neutral
585114189527552001,2015-04-06 16:17:48,b'Welcome @Chiefboltkennyh to @TeslaMotors. He will apply Formula 1 techniques to revolutionize servicing mainstream cars.',welcome apply formula technique revolutionize servicing mainstream car,0.9,0.8,Positive
584978236053917697,2015-04-06 07:17:34,"b'@johngreen @hankgreen You had me at Sheen or Gaddafi. Must admit to liking ""The Fault in Our Stars"" too. Sad, romantic and beautifully named'",sheen gaddafi must admit like fault star sad romantic beautifully name,0.8333333333333334,0.11666666666666665,Positive
584155770851237888,2015-04-04 00:49:23,b'We just got banned in West Virginia. Oh no.\nhttp://t.co/gNztPDNtVT',get ban west virginia oh,0.0,0.0,Neutral
583383236086136832,2015-04-01 21:39:36,b'RT @CERN: Breaking news: CERN researchers confirm existence of the Force http://t.co/BPp2wV01dp http://t.co/1TXkbUTdsm',break news cern researcher confirm existence force,0.0,0.0,Neutral
583360210292477952,2015-04-01 20:08:07,b'Announcing the amazing Tesla Model W \nhttp://t.co/tI6ztSyuX7',announce amazing tesla model w,0.9,0.6000000000000001,Positive
583053048802508800,2015-03-31 23:47:34,b'RT @newscientist: In 2014 half the investment in new electricity generation was in green tech. http://t.co/reHPdUGPwu http://t.co/ih7uk2lP95',half investment new electricity generation green tech,0.30707070707070705,-0.07676767676767678,Negative
582962573626224643,2015-03-31 17:48:03,b'RT @TeslaMotors: Look at them go. @BenJerrysTour driving climate change. #ActOnClimate http://t.co/ciu3OHwbmj',look go drive climate change actonclimate,0.0,0.0,Neutral
582934217790607360,2015-03-31 15:55:22,"b'With all that solar power being generated, it almost feels like something is needed to complete the picture ...'",solar power generate almost feel like something need complete picture,0.4,0.1,Positive
582930941720432641,2015-03-31 15:42:21,b'SolarCity just hit a new daily energy record of 5GWh two weeks after reaching 4GWh',solarcity hit new daily energy record two week reach,0.22727272727272727,0.06818181818181818,Positive
582820630950604800,2015-03-31 08:24:01,b'RT @Zedd: \xf0\x9f\x99\x88 http://t.co/B938NKpReW',,0.0,0.0,Neutral
582581865682350080,2015-03-30 16:35:15,"b'Major new Tesla product line -- not a car -- will be unveiled at our Hawthorne Design Studio on Thurs 8pm, April 30'",major new tesla product line car unveil hawthorne design studio thur april,0.4772727272727273,0.09943181818181818,Positive
581273207908388864,2015-03-27 01:55:06,"b""RT @motherboard: Elon Musk says we shouldn't need an environmentally motivated reason to ditch fossil fuels:\nhttp://t.co/kv0wVukbkx http://\xe2\x80\xa6""",elon musk say need environmentally motivate reason ditch fossil fuel,0.0,0.0,Neutral
580482462612135936,2015-03-24 21:32:58,"b'Right move is try both tunnels and flying cars. Otherwise, having 2D streets and 3D buildings means bad traffic forever.'",right move try tunnel fly car otherwise street building mean bad traffic forever,0.6974702380952381,0.018303571428571502,Positive
580480774115364864,2015-03-24 21:26:16,"b'Reasons I like tunnels: you still travel in 3D fast, but immune to weather, quiet and no risk cars fall on your head'",reason like tunnel still travel fast immune weather quiet risk car fall head,0.4666666666666667,0.1,Positive
