id,created_at,text,tweet,subjectivity,polarity,sentiment
371098424294133760,2013-08-24 02:35:33,b'@Jon_Favreau Yup. We saw it in the movie and made it real. Good idea!',yup see movie make real good idea,0.9000000000000001,1.0,Positive
371032852101484544,2013-08-23 22:15:00,b'Will post video next week of designing a rocket part with hand gestures &amp; then immediately printing it in titanium',post video next week design rocket part hand gesture amp immediately print titanium,0.0,0.0,Neutral
371030745449369600,2013-08-23 22:06:37,"b'And, uhh no (zillionth person who asked), I am not going to make an IM suit, however design by hand-manipulated hologram is actually useful.'",uhh zillionth person ask go make im m suit however design hologram actually useful,0.0,0.3,Positive
371029699385774083,2013-08-23 22:02:28,b'@brynmooser Reality is the best illusion',reality good illusion,0.6000000000000001,0.7,Positive
371028785476284416,2013-08-23 21:58:50,b'We figured out how to design rocket parts just w hand movements through the air (seriously). Now need a high frame rate holograph generator.',figure design rocket part w hand movement air seriously need high frame rate holograph generator,0.6033333333333333,-0.08666666666666666,Negative
369627580166451200,2013-08-20 01:10:57,b'Model S achieves best safety rating of any car ever tested by US govt http://t.co/W1rZ5ceEVX',model achieve good safety rating car ever test us govt,0.6000000000000001,0.7,Positive
368461203317612544,2013-08-16 19:56:11,"b'Same rocket flight, but this time with cows! http://t.co/qhF5JWzyCW'",rocket flight time cow,0.16666666666666666,-0.13333333333333333,Negative
367545423495311360,2013-08-14 07:17:12,"b'Latest rocket test flight: hard lateral deviation, stabilize &amp; hover, rapid descent back to pad http://t.co/Vb7ebiMdNJ'",late rocket test flight hard lateral deviation stabilize amp hover rapid descent back pad,0.38055555555555554,-0.19722222222222222,Negative
367028946426019840,2013-08-12 21:04:54,"b'Btw, this is not the very latest version. Will post an updated version with several late arriving corrections in a few hours.'",btw late version post update version several late arrive correction hour,0.39999999999999997,-0.19999999999999998,Negative
367025547852800000,2013-08-12 20:51:24,b'Hyperloop Alpha at http://t.co/ZRTcT2b8bP and http://t.co/7cucKKprPB http://t.co/LYhuRxUntA',hyperloop alpha,0.0,0.0,Neutral
366964441159438337,2013-08-12 16:48:35,b'Pulled all nighter working on Hyperloop (as did others). Hopefully not too many mistakes. Will publish link at 1:30 PDT.',pull nighter work hyperloop other hopefully many mistake publish link pdt,0.4375,0.1875,Positive
365141071912640512,2013-08-07 16:03:10,b'Hangout with @richardbranson &amp; me tomorrow at 9am California time http://t.co/0ELMam5wXq',hangout amp tomorrow california time,0.0,0.0,Neutral
362836613539176448,2013-08-01 07:26:04,b'\xe2\x80\x9c@eirene_inc: \xe2\x80\x9cThe universe is prob littered w/ the 1-planet graves of cultures which made the sensible economic http://t.co/Bp6592r9bH\xe2\x80\x9d',universe prob litter grave culture make sensible economic,0.2,0.2,Positive
361316902804529153,2013-07-28 02:47:17,"b'One of the first Tesla Supercharger stations in Europe is being built in Cinderella, Norway #KatieWoodencloak'",one first tesla supercharger station europe build cinderella norway katiewoodencloak,0.3333333333333333,0.25,Positive
360145548310872064,2013-07-24 21:12:44,"b'RT @TeslaMotors: Model S\' groundbreaking platform is displayed in the center of London for @DesignMuseum ""The Future is Here"" exhibit! http\xe2\x80\xa6'",model groundbreaking platform display center london future exhibit,0.1125,-0.05,Negative
359943337127579649,2013-07-24 07:49:13,"b'Best saying ever \xe2\x80\x9c@temochdez: there is a saying in Mexico: ""El miedo no anda en burro"" meaning ""Fear doesn\'t ride on a donkey""\xe2\x80\x9d'",good say ever say mexico el miedo anda en burro mean fear ride donkey,0.64375,0.19374999999999998,Positive
359924692972351488,2013-07-24 06:35:08,b'RT @UberObvi: It gets dark when the sun goes down.',get dark sun go,0.4,-0.15,Negative
359751821104906240,2013-07-23 19:08:12,b'RT @physorg_com: Valley networks suggest ancient snowfall on #Mars http://t.co/FEx8SEVrCl @BrownUniversity',valley network suggest ancient snowfall mar,0.0,0.0,Neutral
359750424175185920,2013-07-23 19:02:39,"b""Oh yeah, well Tesla will study a plan to study the GM team that's studying Tesla, so there! http://t.co/Gn41zsaRv8""",oh yeah well tesla study plan study gm team study tesla,0.0,0.0,Neutral
356818414431506432,2013-07-15 16:51:54,"b""@John_Gardi your guess is the closest I've seen anyone guess so far. Pod diameter probably around 2m""",guess close see anyone guess far pod diameter probably around,1.0,0.1,Positive
356779314043305985,2013-07-15 14:16:31,b'@schadlu I really hate patents unless critical to company survival. Will publish Hyperloop as open source.',really hate patent unless critical company survival publish hyperloop open source,0.7333333333333334,-0.26666666666666666,Negative
356777845739110400,2013-07-15 14:10:41,"b'@TobiasVdb Yes, it is a purely propulsive landing, but using the huge landing gear A frames as air brakes. Landing prop &lt; 5% of vehicle mass'",yes purely propulsive land use huge land gear frame air brake land prop lt vehicle mass,0.7,0.30714285714285716,Positive
356776740409974785,2013-07-15 14:06:18,b'Will publish Hyperloop alpha design by Aug 12. Critical feedback for improvements would be much appreciated.',publish hyperloop alpha design aug critical feedback improvement would much appreciate,0.5,0.1,Positive
356774005094617090,2013-07-15 13:55:26,"b""RT @profoundlypaige: @elonmusk http://t.co/nyO4BxYfcz is helpful, as is reiterating that you're about *efficiency*. Most no-brainer compone\xe2\x80\xa6""",helpful reiterate efficiency,0.0,0.0,Neutral
356771814271234050,2013-07-15 13:46:43,b'Just completed full mission duration firing of next gen Falcon 9 booster. V proud of the boost stage team for overcoming many tough issues.',complete full mission duration fire next gen falcon booster v proud boost stage team overcome many tough issue,0.5472222222222223,0.22685185185185186,Positive
356760670643032064,2013-07-15 13:02:26,"b'RT @LeilaniMunter: Dear Oil, I am breaking up with you... http://t.co/D0cxsW6yt1 --- @TeslaMotors @elonmusk @TeslaMotorsClub'",dear oil break,0.0,0.0,Neutral
354999620629303296,2013-07-10 16:24:39,b'@BrianDunning @SpaceX New spacesuit almost done. Hoping to unveil by end of year.',new spacesuit almost do hope unveil end year,0.45454545454545453,0.13636363636363635,Positive
354986137753890816,2013-07-10 15:31:05,b'So true \xe2\x80\x9c@jlgolson: BitTorrent packet goes to a bar and asks for beer. Everyone in the bar who already has a beer gives him a sip.\xe2\x80\x9d',true bittorrent packet go bar ask beer everyone bar already beer give,0.65,0.35,Positive
354705218648289281,2013-07-09 20:54:48,b'UDP (yeah you know me) 3X',udp yeah know,0.0,0.0,Neutral
354690624051609600,2013-07-09 19:56:49,"b'TCP packet walks into a bar &amp; says \xe2\x80\x9cI\xe2\x80\x99d like a beer.\xe2\x80\x9d Barman replies \xe2\x80\x9cYou\xe2\x80\x99d like a beer?\xe2\x80\x9d \xe2\x80\x9cYes,\xe2\x80\x9d replies TCP packet,\xe2\x80\x9cI\xe2\x80\x99d like a beer.\xe2\x80\x9d'",tcp packet walk bar amp say like barman reply like beer reply tcp packet like,0.0,0.0,Neutral
354644852002144256,2013-07-09 16:54:56,b'RT @physorg_com: 5D optical #memory in #glass could record the last evidence of civilization http://t.co/3k8jAz3Z88',optical memory glass could record last evidence civilization,0.06666666666666667,0.0,Neutral
353309492131278848,2013-07-06 00:28:41,"b'Latest vertical landing rocket vid. 325M altitude, hold against wind, land w T/W&gt;1, radar in loop http://t.co/I68Xxpb1EQ'",late vertical land rocket vid altitude hold wind land w gt radar loop,0.6,-0.3,Negative
352136446909489153,2013-07-02 18:47:25,"b'Woohoo, Tesla direct sales petition passed the 100k threshold! Thanks a lot to everyone that helped!!'",woohoo tesla direct sale petition pass threshold thank lot everyone help,0.4,0.1,Positive
351262074124505089,2013-06-30 08:52:59,"b'Have been reading about Henry Fielding, who had the most excellent pen name of Captain Hercules Vinegar'",read henry field excellent pen name captain hercule vinegar,1.0,1.0,Positive
351094587105878016,2013-06-29 21:47:27,b'One learns something new every day \xe2\x80\x9c@UberFacts: A \xe2\x80\x9cButtload\xe2\x80\x9d is an actual measurement of volume - Equal to 126 gallons.\xe2\x80\x9d',one learn something new every day actual measurement volume equal,0.2681818181818182,0.04545454545454545,Positive
350690789925453824,2013-06-28 19:02:54,b'@davidepley Thanks :)',thank,0.0,0.0,Neutral
350690638943109121,2013-06-28 19:02:18,"b'@lougil_ace Taking action. Will be a 7 day grace period for $2500 ext warranty. Neg margin at that price, so must unfortunately raise.'",take action day grace period ext warranty neg margin price must unfortunately raise,0.55,-0.2,Negative
350673032144105472,2013-06-28 17:52:20,"b""RT @John_Gardi: @elonmusk You should point out this campaign wasn't started by TM but by concerned citizens that want a fair deal &amp; a futur\xe2\x80\xa6""",point campaign start tm concern citizen want fair deal amp,0.9,0.7,Positive
350666408985767937,2013-06-28 17:26:01,b'Please support the White House petition to allow direct sales of cars to consumers in all states http://t.co/nHrH69MD3W',please support white house petition allow direct sale car consumer state,0.2,0.05,Positive
349582778318336001,2013-06-25 17:40:03,"b'@arthurblake Turning recirc off, windows closed and the right film on rear glass usually works. Am asking HVAC engineering to investigate.'",turn recirc window close right film rear glass usually work ask hvac engineer investigate,0.39285714285714285,0.01785714285714285,Positive
349556671447699456,2013-06-25 15:56:19,b'@arthurblake Tesla service can do coating or can be done by any auto glass coating company. My car is done on side &amp; rear',tesla service coat do auto glass coat company car do side amp rear,0.0,0.0,Neutral
349556116881022976,2013-06-25 15:54:07,"b'@arthurblake Turn off AC recirc, so that cool air flows out thru rear vents &amp; get IR coating on rear glass.'",turn ac recirc cool air flow thru rear vent amp get ir coat rear glass,0.65,0.35,Positive
349034068849094656,2013-06-24 05:19:41,b'@justinchace will do',,0.0,0.0,Neutral
348116700983607296,2013-06-21 16:34:23,"b'@LisaRoutel The NY auto dealers lost in court, so now they are funding a bill in NY legislature to block Tesla'",ny auto dealer lose court funding bill ny legislature block tesla,0.0,0.0,Neutral
348097024710819840,2013-06-21 15:16:12,b'RT @TeslaMotors: Tesla Pack Swap Event video is up: http://t.co/KeUoBoMYEB',tesla pack swap event video,0.0,0.0,Neutral
347973928377004032,2013-06-21 07:07:04,"b'Tesla pack swap vid still being edited (multiple camera angles). In meantime, this article contains a vid http://t.co/lyzJy4k8Eu'",tesla pack swap vid still edit multiple camera angle meantime article contain vid,0.0,0.0,Neutral
347617421500243968,2013-06-20 07:30:26,b'Tomorrow night: fastest gas pump in LA vs Tesla battery pack swap http://t.co/QgZzggjIkq',tomorrow night fast gas pump la vs tesla battery pack swap,0.6,0.2,Positive
347264432063258624,2013-06-19 08:07:47,b'Partial recall of Model S http://t.co/uDZ1f3RnjV',partial recall model,0.3,-0.1,Negative
347082201596321794,2013-06-18 20:03:39,"b'Battery pack swap works with all Tesla Model S cars, past and present. It was always there.'",battery pack swap work tesla model car past present always,0.125,-0.125,Negative
347005150860283905,2013-06-18 14:57:29,"b'@zatulsky Shai actually got the idea from a visit to Tesla. The idea is obvious (many things allow battery swap), but the technology is not.'",shai actually get idea visit tesla idea obvious many thing allow battery swap technology,0.3666666666666667,0.16666666666666666,Positive
346896666055569408,2013-06-18 07:46:24,"b'Video of battery pack swap will be posted to the Tesla website around 9:30pm, so those attending will see this first.'",video battery pack swap post tesla website around attend see first,0.3333333333333333,0.25,Positive
346895679471357952,2013-06-18 07:42:29,b'Live pack swap demo on Thurs night at 8pm California time at our design studio in Hawthorne. Seeing is believing.',live pack swap demo thur night california time design studio hawthorne see believe,0.5,0.13636363636363635,Positive
344839352578363392,2013-06-12 15:31:23,b'Battery storage of solar power needed for night operation &amp; to buffer grid during day. Beta projects are going well.',battery storage solar power need night operation amp buffer grid day beta project go well,0.0,0.0,Neutral
344705055880007680,2013-06-12 06:37:44,"b'A long way to go before most power generation is solar, but the second derivative bodes well http://t.co/Af1c9xmyjn'",long way go power generation solar second derivative bode well,0.2,-0.025,Negative
344015395067408385,2013-06-10 08:57:16,b'1st long duration firing of the new generation Falcon 9 rocket ~1.5 million pounds of vac thrust http://t.co/iGZadNVF7w',long duration fire new generation falcon rocket million pound vac thrust,0.42727272727272725,0.043181818181818175,Positive
343446166043766784,2013-06-08 19:15:21,b'@mcrsqr True',true,0.65,0.35,Positive
343443647435534336,2013-06-08 19:05:21,b'We need more women in aerospace like Gwynne!  http://t.co/bTl7t5nWZx',need woman aerospace like gwynne,0.0,0.0,Neutral
342664071042187264,2013-06-06 15:27:35,"b""Easier said than done. There is a lot of pressure from investors. It is hard not to feel super bad if u don't make ur qtr.""",easy say do lot pressure investor hard feel super bad u make ur qtr,0.6770833333333333,-0.05624999999999997,Negative
342662893461983232,2013-06-06 15:22:54,"b'Mars requires developing complex technology over a decade+, but market cares about next 3 months. Result would be conflicting priorities.'",mar require develop complex technology market care next month result would conflict priority,0.2,-0.15,Negative
342660248328347649,2013-06-06 15:12:24,"b""@SQMInc I don't have a publicist""",publicist,0.0,0.0,Neutral
342566837852200960,2013-06-06 09:01:13,b'No near term plans to IPO @SpaceX. Only possible in very long term when Mars Colonial Transporter is flying regularly.',near term plan ipo possible long term mar colonial transporter fly regularly,0.5553846153846154,0.17,Positive
342107352041922560,2013-06-05 02:35:23,"b'Forgot to say one thing at Tesla annual shareholders meeting: just as my money was the first in, it will be the last out.'",forget say one thing tesla annual shareholder meeting money first last,0.19999999999999998,0.125,Positive
341688528125689858,2013-06-03 22:51:08,b'Love this image of Dragon docked to the Space Station as it orbits through dark side of Earth http://t.co/kygcsEQNhk',love image dragon dock space station orbit dark side earth,0.5,0.175,Positive
341462587482963968,2013-06-03 07:53:19,b'Vac thrust of 700 tons means avg of 14 tons/floor of structural steel for a 50 story building.',vac thrust ton mean avg structural steel story build,0.6875,-0.3125,Negative
341441460215889920,2013-06-03 06:29:22,b'@williamricci6 50% higher. ~1.3 M lbs sea level and ~1.5 M lbs vacuum thrust. Will be 60% higher with some tweaks.',high lb sea level lb vacuum thrust high tweak,0.35999999999999993,0.10388888888888888,Positive
341405518566395904,2013-06-03 04:06:33,"b'1st firing of Falcon 9-R advanced prototype rocket. Over 1M lbs thrust, enough to lift skyscraper http://t.co/AUCsWTw77E'",fire falcon advanced prototype rocket lb thrust enough lift skyscraper,0.55,0.2,Positive
340177739426435073,2013-05-30 18:47:47,b'Huge expansion of Tesla Supercharger network underway. Will cover LA to NY by end of year http://t.co/MFKjBJzklc',huge expansion tesla supercharger network underway cover la ny end year,0.9,0.4000000000000001,Positive
340043575167430656,2013-05-30 09:54:40,b'Bloomberg TV features debate of @AndreaSJames vs some guy picking his nose http://t.co/n5Iu91Wu1r',bloomberg tv feature debate vs guy pick nose,0.0,0.0,Neutral
338770339637129216,2013-05-26 21:35:17,"b'@RobertGaristo V much agree. Moreover, there is risk of severe non-linearities in feedback loops causing sudden warming.'",v much agree moreover risk severe feedback loop cause sudden warm,0.4333333333333333,0.26666666666666666,Positive
338766100718305281,2013-05-26 21:18:27,"b""RT @RobertGaristo: @elonmusk I'm a physicist &amp; 97% # seems right\xe2\x80\x94v rare to find a scientist not convinced by evidence, &amp; ~none think there \xe2\x80\xa6""",physicist amp seem rare find scientist convince evidence amp think,0.9,0.3,Positive
338504412035158016,2013-05-26 03:58:35,b'You Can Fit A Lot Of Kindergartners In A Tesla Model S - Houston Chronicle http://t.co/iOZPxrx3sa',fit lot kindergartner tesla model houston chronicle,0.4,0.4,Positive
338402827305119744,2013-05-25 21:14:55,"b'Am thinking of doing a movie ""sequel"" of sorts to Thank You for Smoking. That was bad CO2 for indiv, this for the planet'",think movie sequel sort thank smoke bad indiv planet,0.6666666666666666,-0.6999999999999998,Negative
338399341641342976,2013-05-25 21:01:04,b'Worth reading Merchants of Doubt. Same who tried to deny smoking deaths r denying climate change http://t.co/C6H8HrzS8X',worth read merchant doubt try deny smoke death r deny climate change,0.1,0.3,Positive
338394028930392064,2013-05-25 20:39:58,"b'Yeah, climate change should really be considered a centrist issue, as it affects everyone.'",yeah climate change really consider centrist issue affect everyone,0.2,0.2,Positive
338390383434276864,2013-05-25 20:25:29,"b'Am not suggesting shutting down CO2 production, but rather to price in environmental cost &amp; shift to sustainable energy'",suggest shut production rather price environmental cost amp shift sustainable energy,0.0,0.0,Neutral
338384388091940864,2013-05-25 20:01:39,"b'Even if the answer is only on the order of 1%, we should still take immediate action, as there is only one atmosphere.'",even answer order still take immediate action one atmosphere,0.1,0.1,Positive
338383967009009664,2013-05-25 19:59:59,b'Right question to ask Dyson or others: what is probability that human actions could cause catastrophic climate change?',right question ask dyson other probability human action could cause catastrophic climate change,0.27767857142857144,0.06517857142857142,Positive
338383504339505152,2013-05-25 19:58:08,b'What most serious scientists have a problem with is the notion of certainty about *any* subject. That is not the point.',serious scientist problem notion certainty subject point,0.5,-0.25,Negative
338367123455885312,2013-05-25 18:53:03,b'@kn0xvi11ain Very few. Scientific consensus at time of Columbus was world was round http://t.co/V3XIcob4s8',scientific consensus time columbus world round,0.4,-0.2,Negative
338360832410939392,2013-05-25 18:28:03,"b'Sorry for all the heavy stuff abt climate change, but I really thought world wd take action sooner. No time for subtlety'",sorry heavy stuff abt climate change really think world wd take action soon time subtlety,0.45,-0.09999999999999998,Negative
338359304216256512,2013-05-25 18:21:59,b'@1stHubbleFan @keithwarren Exactly',exactly,0.25,0.25,Positive
338357776889823232,2013-05-25 18:15:55,"b'In reality, 97% of scientists agree that we face serious human generated climate change http://t.co/soQCnJB61B'",reality scientist agree face serious human generate climate change,0.3833333333333333,-0.16666666666666666,Negative
338356013583441920,2013-05-25 18:08:54,"b'Climate change deniers claim ""scientists disagree"", same rebuttal used by tobacco industry about lung cancer for decades'",climate change denier claim scientist disagree rebuttal use tobacco industry lung cancer decade,0.0,0.0,Neutral
338199136635604992,2013-05-25 07:45:32,"b'Good article on ""Climate Change"" vs ""Global Warming"" referred by @ForrestTanaka http://t.co/D1s4RJ0qus'",good article climate change vs global warm refer,0.4000000000000001,0.4333333333333333,Positive
338195298818068480,2013-05-25 07:30:17,"b'RT @UberFacts: There\'s an Iron Man edition of Mr. Potato Head named ""Tony Starch.""'",iron man edition mr potato head name tony starch,0.0,0.0,Neutral
338135523765919745,2013-05-25 03:32:45,"b'Was beat up pretty badly as a kid &amp; left me w jagged septum. Harder to breathe as I got older, so time to fix.'",beat pretty badly kid amp leave w jag septum hard breathe get old time fix,0.6020833333333333,-0.16041666666666662,Negative
338130215492521984,2013-05-25 03:11:40,"b'RT @1stHubbleFan: @GaryDownie @elonmusk Wrong! Science helps confirm #climatechange by, once again, pointing to #sealevelrise: http://t.co/\xe2\x80\xa6'",wrong science help confirm climatechange point sealevelrise,0.9,-0.5,Negative
338129661307531264,2013-05-25 03:09:28,"b""Had a minor operation, so am in bed in meds. Probably shouldn't be tweeting :)""",minor operation bed med probably tweet,0.2,-0.05,Negative
338127750126764032,2013-05-25 03:01:52,b'Sign of a good design is that it feels and is much bigger on inside than looks on outside',sign good design feel much big inside look outside,0.25000000000000006,0.2333333333333333,Positive
338123049465421824,2013-05-25 02:43:11,b'@CosmicRami Awesome. We really need to promote that fact in the US. A CO2 tax will not cause economy to grind to a halt!',awesome really need promote fact us tax cause economy grind halt,0.6,0.6,Positive
338117807910813696,2013-05-25 02:22:21,"b'Would love to do a pickup truck. Something w ultra low cg for sports car handling, dynamic air suspension &amp; mega torque.'",would love pickup truck something w ultra low cg sport car handle dynamic air suspension amp mega torque,0.35555555555555557,0.16666666666666666,Positive
338115331891556352,2013-05-25 02:12:31,"b'Technically, I ""got rich"" from Zip2 &amp; PayPal w zero govt anything, then put 100% of that into SpaceX, Tesla &amp; SolarCity.'",technically get rich amp paypal w zero govt anything put spacex tesla amp solarcity,0.425,0.1875,Positive
338112989578293248,2013-05-25 02:03:13,"b'If consumption is low, then the tax is proportionately low. We should prob not have tax on basic foods &amp; critical meds.'",consumption low tax proportionately low prob tax basic food amp critical med,0.38125,0.0,Neutral
338110772167184385,2013-05-25 01:54:24,"b'@ponder68 Carbon produced by a @SpaceX rocket flight is roughly equal to one 747 flight. No, we should not be exempt.'",carbon produce rocket flight roughly equal one flight exempt,0.25,0.0,Neutral
338110231005499394,2013-05-25 01:52:15,"b'Net of gas savings, a Tesla is $550 to $600/month with down payment taken care of by tax credits. Maybe less costly then it first seems.'",net gas saving tesla payment take care tax credit maybe less costly first seem,0.13333333333333333,0.02777777777777778,Positive
338108608430632960,2013-05-25 01:45:48,"b'Yes, am arguing against subsidies and in favor of a tax on the end bad created. Market will then achieve best solution.'",yes argue subsidy favor tax end bad create market achieve good solution,0.6333333333333333,5.551115123125783e-17,Positive
338107634668412928,2013-05-25 01:41:56,"b'Trees are net consumers of CO2, so technically we would pay them money :)'",tree net consumer technically would pay money,0.05,0.0,Neutral
338106902946910208,2013-05-25 01:39:02,b'Exactly. Seems crazy to risk the CO2 chemical experiment when we have to find another solution anyway.',exactly seem crazy risk chemical experiment find another solution anyway,0.575,-0.175,Negative
338105723139543040,2013-05-25 01:34:20,b'Big difference between taxing people and taxing purchases (ie consumption). Much better to emphasize the latter.',big difference tax people tax purchase ie consumption much well emphasize latter,0.10000000000000002,0.06666666666666667,Positive
338104612521385984,2013-05-25 01:29:55,b'@MaxMBerger The collective wisdom of the market is usually (not always) better than the smartest govt regulator.',collective wisdom market usually always well smart govt regulator,0.44642857142857145,-0.017857142857142863,Negative
338103612943241218,2013-05-25 01:25:57,"b'Me &amp; other private money funded Tesla for first 7 years, got IPO+ govt money for 3, now paid back. Yes, carbon tax would be a better way.'",amp private money fund tesla first year get govt money pay back yes carbon tax would well way,0.23611111111111108,0.08333333333333333,Positive
338102635930468352,2013-05-25 01:22:04,"b'@grayj_ There should be a constitutional amendment to redo the tax code every ten years, just like we do a census.'",constitutional amendment redo tax code every ten year like census,0.0,0.0,Neutral
338101143047639042,2013-05-25 01:16:08,"b""Weight of scientific evidence. Taxes don't ban a purchase, they just increase cost. Am against bans, except in extreme cases.""",weight scientific evidence taxis ban purchase increase cost ban except extreme case,1.0,-0.125,Negative
338099836404527104,2013-05-25 01:10:57,"b'Exactly. Better to tax known bad thing and incent desired outcome, instead of subsidizing particular solution paths. Let market decide.'",exactly well tax know bad thing incent desire outcome instead subsidize particular solution path let market decide,0.4166666666666667,-0.0944444444444444,Negative
338098445808201728,2013-05-25 01:05:25,"b'Perhaps. I am in favor of fair, simple taxes that are neutral on most things, incent good &amp; disincent bad.'",perhaps favor fair simple taxis neutral thing incent good amp disincent bad,0.6309523809523809,0.17500000000000002,Positive
